Ссылка,Наименование,Цена,Рейтинг пользователей,Описание продукта,Инструкция по применению,Cтрана-производитель
https://goldapple.ru/19000166822-double-attack,Double Attack,16254,5,"Чемпионы создают судьбу сами и готовы рискнуть всем ради триумфа, когда шансы в их пользу. Аккорд шоколада создает смесь многогранных горьковато-сладких и древесных нот, которые определяют характер аромата. Специи и цветы разрушают преграды, а затем уступают место чарующим бурбону и ванили. Исследуйте разум, чувства, силу духа с MIND GAMES и погрузитесь в стратегически идеальные композиции.",Распылите на кожу с расстояния 20-30 см.,США
https://goldapple.ru/26830400003-dreaming-with-ghosts,Dreaming with Ghosts,8857,4.7,"Фантазия об особенной нежности. В поисках неожиданной красоты, потерянной в тёмном мире… Она ускользает, словно изменчивый, неуловимый фантом. Dreaming with Ghosts – это путешествие между сном и реальностью. Бодрящая айва сочетается со светлыми нотами ванили и ветивера, окутанными ароматом кожи. 
Основная идея – отражение нежности. Ваниль в сочетании с кожей и ветивером раскрывает мягкую чувственность, которую подчеркивают яркие цветочные ноты пиона и бархатцев. Из сна в реальность возвращает яркий фруктовый аккорд айвы, напоминающий сочетание груши и яблока. 

Верхние ноты: бархатцы, айва
Ноты сердца: пион, кожа
Базовые ноты: ветивер, ваниль",,Франция
https://goldapple.ru/19000249577-ange-des-vignes,Ange des Vignes,4890,,"Компания Caudalie представляет свою первую парфюмерную воду Ange des Vignes ― искрящуюся и соблазнительную. <br><br>Ее шипровый аромат раскрывается фруктовыми нотами малинового винограда, невесомого нероли и обволакивающего пачули. Неземной, завораживающий и чувственный полет между небом и виноградной лозой.",,Франция
https://goldapple.ru/19000186240-tobacco,TOBACCO,4080,,,,Франция
https://goldapple.ru/19000004549-perfume-vanilla-blend,Black vanilla,2200,4.8,"Я хочу, чтобы парфюм трогал до глубины души, говорил о личности и отражал ее уникальность.<br>
Эрез Розен <br><br>

Замысловатая ольфакторная книга, сюжет которой раскрывается новыми гранями на каждом человеке. Необычные сочетания нот и оригинальное построение аккордов подчеркивают индивидуальность и раскрывают суть ярче любых слов. <br><br>

Все ароматы Zielinski&Rozen категории унисекс.",Наносите парфюм по обе стороны плеч или распылите впереди себя и войдите в «облако» аромата.,Россия
https://goldapple.ru/19000156228-homme-woody-musk,Homme Woody Musk,6246,4.9,"Чистая и чувственная парфюмерная композиция ARMAND BASI посвящена красоте мускуса – важнейшего для парфюмерии ингредиента, способного окутать чувством комфорта и усилить стойкость аромата. 
<br/>Раскрыть мускус с новой стороны позволяют пряные ноты кардамона, имбиря и перца, усиленные свежестью лимона и бергамота. 
<br/>В сердце аромата доминирует аккорд чистоты, объединивший альдегиды и цветок апельсина, шалфей и амброксан. 
<br/>Глубину и насыщенность ноты мускуса усиливают благородный кедр и чувственный кашмеран. 
<br/>Классификация аромата: древесный мускусный. Парфюмер – Aurélien Guichard.",Только для наружного применения.,Италия
https://goldapple.ru/19000041892-602-poivre-cedre-patchouli,"602 – poivre, cèdre, patchouli",2400,4.4,"Перец, кедр, пачули – 3 характерные ноты парфюмерной воды 402 от BON PARFUMEUR. Эта древесная композиция, украшенная острым аккордом южных пряностей, дарит приятное ощущение спокойствия и комфорта. Аромат приветствует солнечной нотой нероли, которая переплетается со свежестью цветочных нот и ярким аккордом специй. В сердце композиции раскрывается таинственное звучание мадагаскарского черного перца, кедра и сомалийского ладана. Гармонию холодных и пряных нот дополняют пачули, ветивер и бензоин, добавляющие дымчатую грань древесно-пряному аромату, который также имеет и черты фужерной композиции.
   
Верхние ноты: ладан, нероли 
Ноты сердца: перец чили, кедр 
Базовые ноты: ладан, пачули, ветивер, бензоин",только для наружного применения.,Франция
https://goldapple.ru/19000186241-cashmere,CASHMERE,4080,,,,Франция
https://goldapple.ru/19000039602-allegra-baciami,ALLEGRA Baciami,12861,5,"Цветочная амбровая композиция Baciami – словно пьянящее любовное зелье, способное вызвать зависимость. Притягательные ноты гардении и ванили настраивают на романтичный лад и напоминают о сладких поцелуях. Чарующая парфюмерная вода из коллекции Bvlgari Allegra воплощает один из секретов итальянского соблазнения – волнующий аромат. Усилить звучание композиции и создать индивидуальное сочетание под своё настроение можно с помощью одной из эссенций коллекции Bvlgari Allegra, идеально дополняющих гармонию нот. Ваш персонализированный аромат начинается здесь!

Ключевые ноты: гардения, ваниль",,Италия
https://goldapple.ru/19000004553-black-pepper-amber-neroli,"Black Pepper, Vetiver, Neroli, Amber",2200,4.8,"Я хочу, чтобы парфюм трогал до глубины души, говорил о личности и отражал ее уникальность.<br>
Эрез Розен <br><br>

Замысловатая ольфакторная книга, сюжет которой раскрывается новыми гранями на каждом человеке. Необычные сочетания нот и оригинальное построение аккордов подчеркивают индивидуальность и раскрывают суть ярче любых слов. <br><br>

Все ароматы Zielinski&Rozen категории унисекс.",Наносите парфюм по обе стороны плеч или распылите впереди себя и войдите в «облако» аромата.,Россия
https://goldapple.ru/19000152687-flora-bloom,FLORA BLOOM,900,4.3,"Насыщенный и пьянящий аромат LE PARFUM FRANCAIS – это пышный букет цветов, в котором собраны роза, ирис, жасмин и лилия. <br/>Изысканную, но при этом чувственную композицию украшает фруктовая свежесть грейпфрута и черной смородины. <br/>Пачули, бобы тонка и лёгкая сладость ванили гармонично дополняют женственный цветочный аромат.",,Франция
https://goldapple.ru/19000186237-sugar,SUGAR,11135,,,,Франция
https://goldapple.ru/19000225181-musc-ambre-gris,MUSC-AMBRE GRIS,12082,,"Притягательный аромат AFFINESSENCE из коллекции Notes de Fond (или Base Notes collection) раскрывает уникальные свойства ценной серой амбры, излучающей чувственное тепло и минеральную свежесть. <br><br>

Силу непреодолимого притяжения приумножают ноты черного мускуса и белого трюфеля, подчеркивающие эффект контраста «горячего и холодного» в композиции. <br>
Пачули, гаитянский ветивер и аккорд мате дополняют мощную, богатую энергию этого глубокого, эффектного аромата, который хочется вдыхать снова и снова. <br><br>

Парфюмеры – Henri Bergia и Sophie Bruneau.",Только для наружного применения.,Франция
https://goldapple.ru/19000186239-niravana,NIRVANA,9265,,,,Франция
https://goldapple.ru/19000215579-coconut-cocktail-eau-de-toilette,Coconut cocktail eau de toilette,2016,,"В изысканный набор tutti délices входят туалетная вода COCONUT COCKTAIL (50 мл), её миниатюра (15 мл) и шипучая бомбочка для ванны (1 шт).<br> Аромат COCONUT COCKTAIL – это освежающий, нежный и сладкий кокосовый коктейль. Фруктово-гурманская композиция с намеком на молочные ноты окутывает нежностью и пробуждает приятные воспоминания. <br>
Легкий, напоминающий об отдыхе кокос в сочетании с мускусом, смягчающим десертную сладость ванили и сахара, способен очаровать и вызвать привыкание не только у сладкоежек.","Туалетная вода: только для наружного применения. Распылите на кожу с небольшого расстояния. <br>
Бомбочка для ванны: наберите теплую ванну и опустите в воду бомбочку.",Франция
https://goldapple.ru/19000009365-arme-blanche,ARME BLANCHE,1524,5,"Все оттенки белого – в свежем аромате ARME BLANCHE, отражающем смелость, уверенность, сильный характер и свободу быть собой. Композиция от L’ATELIER PARFUM – словно изысканный и в то же время роскошный букет невесты, в котором собраны красивейшие белые цветы. Чарующие тубероза, жасмин и цветок апельсина, окутанные нежной дымкой мускуса, гармонируют с терпкой нотой нероли. Свежую и легкую, будто белое кружево, композицию украшают чувственный сандал и ветивер. Парфюмер – Alexis Dadier.",,Франция
https://goldapple.ru/19000015648-un-gardenia-la-nut-perfume-gun,Un Gardenia La Nut Perfume Gun ,21500,,"Летняя ночь на Ривьере, где молочная нежность и пряность цветов, благоухавшая днем, уступает место фруктовой свежести в сумерках. Perfume Gun - eдинственное оружие, созданное с любовью.
Яркая ароматная вспышка моментально наполняет пространство любимым ароматом. Роскошные ароматы замаскированы в бутылки, напоминающие очищающие средства для дома. Теперь сменить обстановку стало проще, чем сменить обои и даже переключить музыкальную пластинку. Одно движение – пистолет готов к применению. Простой в применении пульверизатор-курок обеспечивает оптимальное распыление и позволяет контролировать интенсивность аромата.
Рекомендован к использованию в просторных помещениях. Благодаря циркуляции воздуха мгновенно заполняет все пространство. Избегайте попадания на мягкую мебель, предметы интерьера, пластик и текстиль. Не распыляйте вблизи поверхностей, обработанных лакокрасочными покрытиями.","Рекомендован к использованию в просторных помещениях. Благодаря циркуляции воздуха мгновенно заполняет все пространство. Избегайте попадания на мягкую мебель, предметы интерьера, пластик и текстиль. Не распыляйте вблизи поверхностей, обработанных лакокрасочными покрытиями.",Франция
https://goldapple.ru/19000206592-green-garden,Green Garden,11354,,"Свежий цветочный аромат BIRKHOLZ переносит в зеленый и цветущий сад у элегантного замка. Атмосферу тёплого летнего вечера и изысканной вечеринки на открытом воздухе передают нежные ноты фрезии, жасмина и розы, окутанные зеленой свежестью бамбука. <br>
Волшебная обстановка сада, сияющие огоньки, изящные танцы и великолепные наряды – представить всё это помогает чарующая композиция, дополненная чувственным звучанием мускуса, сандала, амбры и туберозы.",Только для наружного применения.,Германия
https://goldapple.ru/19000122111-sovereign,Sovereign ,27060,,"Набор из 4 культовых ароматов коллекции Sovereign: Royal Sapphire, Diadem, Sceptre, Imperial Crown 4х10мл.",,Великобритания
https://goldapple.ru/19000133627-femme-magique,Femme Magique,5418,5,"Современный и чувственный аромат ANGEL SCHLESSER словно окружает волшебным, сияющим ореолом. 
<br/>Секрет его притягательной магии – в ярком сочетании цитрусовых, цветочных и фруктовых нот. Воспользоваться чарами соблазнения помогают сочная малина, чувственный ирис, нежная гардения и легкая сладость ванили. Женственный шлейф, сотканный из звучания белых цветов, восточных и древесных нот, манит за собой и обещает исполнение желаний. 
<br/>Аромат идеально подходит для женщин, уверенных в своих чарах и магнетизме, перед которым невозможно устоять. 
<br/>Классификация аромата: восточный ванильный. 
<br/>Парфюмер – Ane Ayo.",Только для наружного применения.,Италия
https://goldapple.ru/19000163485-dojou-for-her,Dojou for her,5418,,"Стихия этого гармоничного женского аромата ANNAYAKE – земля. Теплая, словно согретый солнцем песок, композиция DOJOU FOR HER мягко окутывает светом с первых нот.  <br><br>

Яркое вступление можжевельника, перца и бергамота уравновешивают фруктовое звучание черной смородины и цветочная чувственность иланг-иланга. В сердце аромата раскрывается нежное сияние флердоранжа и бархатистой мимозы, идеально дополненное мягкой нотой кашмерана. <br><br>

Чувственный шлейф с древесным и амбровым звучанием соткан из нот ветивера, сандала, соблазнительной амбры и тонкой сладости ванили.",Только для наружного применения.,Франция
https://goldapple.ru/19000117842-heliaca,Heliaca ,6580,4.3,"Яркий древесно-пряный аромат HELIACA, созданный в традициях высокой французской парфюмерии, раскрывает удивительную мощь благородного уда. 
<br/>Лёгкую остроту насыщенному древесному аккорду добавляет нота имбиря, а кардамон придает композиции приятную свежесть. Символ этого аромата LE COUVENT – орёл, его свободный полёт и удивительно острый, пронзительный взгляд, от которого не ускользает ничто. 
<br/>Завораживающая, дикая сила этой хищной птицы впечатляет, как и природная гипнотическая сила уда.",Только для наружного применения.,Франция
https://goldapple.ru/7431200001-yellow-diamond,Yellow Diamond ,4816,4.8,"Туалетная вода Versace Yellow Diamond — это яркий, роскошный аромат. В нем много чистых цветочных и древесных оттенков. Сначала парфюм Yellow Diamond окутывает свежестью лимона, сладостью нероли, утонченностью бергамота. Эти нотки пленительны, многообещающи. Но вскоре их сменяют нежность водяной лилии, волшебность апельсина, теплота фрезии. Напоследок вода от Versace дарит капельку древесных ароматов и мускуса. Они волнуют, пробуждают скрытые желания. Эту туалетную воду полюбят зрелые женщины, уверенные в собственной неотразимости, и юные красотки, пытающиеся свести с ума мужчин. Ведь ее аромат подчеркивает их исключительность.",,Италия
https://goldapple.ru/19000139474-bali-surya,BALI—SURYA,6435,,"Остров Бали славится не только своими прекрасными пляжами. Он известен как священное место,
где происходят духовные чудеса. Бали преображает людей, открывает их разум, освобождает от
суеты и соблазнов большого города... 
<br>Аромат от FIILIT PARFUM DU VOYAGE,посвященный
этому цветущему оазису спокойствия, называется SURYA - ""Солнце"". Это обонятельная сказка о
бирюзовых морских зорях, вулканах и водопадах. О белых цветках плюмерии в раскрытой ладони
Будды...
<br><br>SURYA – BALI – это волшебство настоящего парфюма, которое обязательно случится с вами.","Распылить на тело, избегая попадания в глаза",Франция
https://goldapple.ru/19760313195-wave,WAVE,4536,5,"Туалетная вода Missoni Wave – современный и мужественный аромат для молодого, харизматичного и уверенного в себе искателя приключений. Парфюмерная композиция будто соткана из морского бриза, свежести синих волн и итальянской чувственности. Пленительный и яркий аромат погружает в атмосферу Средиземноморья, отсылает к истории, традициям и пейзажам этого региона. Солнечные цитрусы, фантазийный аккорд морской свежести и ароматические ноты встречаются с элегантным древесным аккордом, создавая чувственное сочетание, которое напоминает о кристально чистой воде Средиземного моря.<br>
В сердце аромата переплетаются ноты египетской герани, мускатного шалфея, лаванды и розмарина.",Только для наружного применения,Италия
