Ссылка,Наименование,Цена,Рейтинг пользователей,Описание продукта,Инструкция по применению,Cтрана-производитель
https://goldapple.ru/19000148362-divine-vanille,Divine Vanille,8317,,"Рефил для пополняемого флакона парфюмерной воды ESSENTIAL PARFUMS PARIS ""DIVINE VANILLE by Olivier Pescheux"". Парфюмер – Olivier Pescheux. <br>
«Этот аромат – посвящение мадагаскарской ванили. Я люблю его за глубину, элегантность и притягательность. Мне хотелось раскрыть мягкие, пряные и чувственные грани композиции, наполненной тайной и призывающей оставаться собой».<br><br>

Divine Vanille – таинственный, глубокий и соблазнительный аромат… Устоять невозможно. Нежная нота ванили словно вызывает зависимость, её притягательность усиливают бобы тонка и бензоин. Сочетание корицы и чувственного османтуса раскрывает яркую и неожиданную грань аромата, пробуждающую ассоциации с сухофруктами и табаком. Пачули и древесная нота кедра гармонируют с нежным мускусом. <br><br>

Создатели парфюмерной воды ESSENTIAL PARFUMS выбирают натуральные, экологически чистые материалы и стремятся снизить воздействие на окружающую среду. Кроме того, импорт ванили из Мадагаскара позволяет развивать местную инфраструктуру, образование и здравоохранение, а также продовольственную безопасность. <br><br>

Сделать парфюмерию еще более экологичной и безопасной для окружающей среды позволяет формат рефила, благодаря которому основной флакон парфюмерной воды становится подходящим для многоразового использования. <br><br>

Флакон рефила создан из алюминия, подходящего для переработки.",Откройте оригинальный пополняемый флакон парфюмерной воды и наполните его из рефила. Только для наружного применения.,Франция
https://goldapple.ru/19000118707-moro,MORO,990,,"Ароматы для автомобиля для настоящих ценителей селективных ароматов и стиля.. Ароматизаторы CHIARA Firenze очень просты в использовании: просто прикрепите практичный зажим к вентиляционной решетке и регулируйте интенсивность запаха, включая обдув. Наши ароматы подходят как для ваших ежедневных поездок, так и для длительных путешествий. Наслаждайтесь стилем и с ароматами, которые вы любите!
Это путешествие во времени в салоны Флоренции, где табачные и древесные ноты сочетаются в уникальном аромате, приправленном корицей и подслащенном карамелью и цветами персика.",,Италия
https://goldapple.ru/19000044566-sensual-patchouli-les-eaux-d-un-instant-absolu,Sensual Patchouli LES EAUX D’UN INSTANT ABSOLU,3890,4.8,"Аромат Sensual Patchouli стал парфюмерным воплощением завораживающей и величественной красоты природы, созерцание которой ведет к глубокому чувству покоя. В самом сердце композиции звучат благородные пачули, помогающие достичь гармонии между чувственностью и умиротворением. Чарующая и успокаивающая композиция ANGEL SCHLESSER переносит в затерянный цветущий оазис, поражающий богатством экзотических ароматов. Головокружительное сочетание глубоких зеленых нот, игривых пряностей и нежности жасмина дарит ощущение благополучия, а благородные древесные оттенки усиливают чувства и вдохновляют на размышления и самоанализ. <br>
Классификация аромата – древесный. <br>
Парфюмер – Hamid Merati-Kashani.",Только для наружного применения.,Италия
https://goldapple.ru/19000133648-eau-wild-rose,EAU WILD ROSE ,1490,4.7,"Женственный и яркий цветочный аромат ICEBERG – это современная и смелая парфюмерная интерпретация классической ноты розы. По-новому раскрыть её красоту и подчеркнуть нежность розы помогают бодрящие, свежие итальянские цитрусы и пряный имбирь. Ароматный букет дополняют цветы грейпфрута и чарующий ландыш, окутанные чувственной вуалью амбры, мускуса и древесных нот. Одновременно дерзкая и романтичная композиция не похожа на традиционные ароматы с розой и предлагает новое прочтение культовой ноты.амбра, опопонакс, бензоин 
Парфюмер – Guillaume Flavigny.",только для наружного применения,Италия
https://goldapple.ru/19000234829-altai,Altai,1390,,"Лаконичная аромасвеча из природного кокосового воска плавно наполнит ваше пространство насыщенным парфюмированным шлейфом. Благодаря низкой температуре плавления, кокосовый воск тает эстетично, не оставляя лунок вокруг пламени. Обратите внимание, что в свече - деревянный фитиль, именно поэтому процесс горения сопровождается приятным, потрескивающим звуком горящих в камине поленьев. Насыщенный аромат с высокой концентрацией душистых веществ. <br> Ярчайшие ноты сосны и древесной смолы быстро наполняют помещение ярчайшим ароматом коры дерева и хвои. Аккорд корицы добавляет шлейфу пряность, а мягкие нотки мяты и бергамота - свежесть и легкую прохладу. Вы точно влюбитесь в ALTAI, если мечтаете ощущать в помещении запах горящих в камине поленьев и хвойного леса. <br> ALTAI - идеальное решение для загородного дома и деревянных интерьеров, а также для просторной гостиной в темных тонах.","Перед использованием удалите все декоративные элементы упаковки. Выберите удобное место для свечи, недоступное для детей и животных. Держите свечу зажженной не менее 20 и не более 30 минут. <br> Меры предосторожности <br> Не оставляйте зажженную свечу без присмотра и на сквозняках.<br>  Располагать свечу вне зоны досягаемости детей и домашних животных. <br> Соблюдайте безопасное расстояние от пожароопасных предметов. <br> Обязательной сертификации не подлежит.",Россия
https://goldapple.ru/19000118567-bianco-di-bacco,BIANCO DI BACCO,3492,,"Chiara Firenze посвящает свои ароматы в особый регион: Тоскана. история совершенства, страсти и связи с территорией, а также диалога между знаниями и далекими культурами. парфюмерное искусство и выбор ценных эфирных масел, таким образом, встречает мастеров флорентийских ремесленных мастерских, чтобы возродить магию этой особой земли в ваших комнатах.
Колючие нотки винограда Треббьяно и Мальвазия сочетаются со сладостью белого персика и смолы в соблазнительном аромате, посвященном богу вина!",,Италия
https://goldapple.ru/19000214443-fleur-de-cerisier-et-creme-mains,Fleur de cerisier et crème mains,2572,,"В подарочный набор SOLINOTES входят парфюмерная вода FLEUR DE CERISIER (50 мл) и парфюмированный крем для рук CRÈME MAINS PARFUM FLEUR DE CERISIER (30 мл). <br>
Аромат крема для рук идеально сочетается с парфюмерной водой. Цветочно-фруктовая композиция пробуждает светлые эмоции и романтичное настроение. Весенний и поэтичный аромат построен вокруг ноты цветов вишни – символа хрупкости и чистоты. <br>
Аккорд вишни и красных ягод усиливают освежающие верхние ноты лимона и мандарина, а также игривый пряный кардамон. <br>
В базовых нотах яблоко и мускус создают нежное сочетание, придающее композиции мягкую сладость.",,Франция
https://goldapple.ru/19000010970-allegra-fiori-d-amore,Allegra Fiori D'amore,18009,5,"Парфюмерная вода Fiori D'amore воплощает истинный аромат красной розы, свежей и бархатистой. Чувственная цветочная композиция из коллекции Bvlgari Allegra, раскрывающей яркость и глубину итальянских эмоций, отражает многогранные аспекты любви, мягкую страсть и энергию любовного пыла, присущего итальянцам. Одновременно деликатный и соблазнительный аромат пробуждает чувственность и восторг от получения этого пышного и свежего букета из турецких и болгарских роз, украшенных современным малиновым аккордом. Усилить яркий аромат и создать индивидуальное сочетание под своё настроение можно с помощью одной из эссенций коллекции Bvlgari Allegra, идеально дополняющих композицию. Ваш персонализированный аромат начинается здесь!
 <p>
Ключевые ноты: роза, малина",,Италия
https://goldapple.ru/19000021011-collection-red-poppy-scent,Collection Red Poppy scent,5280,,"Сладкие летние воспоминания ворвутся в Ваш дом с ароматом «Алый цветок». Утонченное сочетание экзотического бергамота и красного мака, украшенное белыми цветами, с мускусно-древесным шлейфом.","Предназначен для ароматизации воздуха в помещениях. Вскрыть флакон с ароматом, вставить палочки, входящие в комплект. Для оптимального распространения аромата регулярно переворачивать палочки. Для регулирования интенсивности аромата допускается уменьшать/увеличивать количество палочек.",Великобритания
https://goldapple.ru/19000110363-dose-of-rose,DOSE OF ROSE,2106,5,"Завораживающий аромат L’ATELIER PARFUM, окутывающий магической аурой чувственности и благородства, воспевает красоту розы и раскрывает суть её очарования. Нежность розовых лепестков подчеркивают пряные ноты гвоздики, яркое звучание шафрана, элегантный жасмин и драматичная, притягательная база, в которой сочетаются кедр и папирус. Чарующий эликсир DOSE OF ROSE, представляющий величественную розу в уникальном свете, оставляет бархатистый и тёплый шлейф с древесным и кожаным аккордами. Ключевые ноты: роза, шафран, кедр. Парфюмер – SIDONIE LANCESSEUR.",только для наружного применения.,Франция
https://goldapple.ru/19000127047-patchouli-de-sumatra,Patchouli de Sumatra ,18075,5,"Пачули из Индонезии и свежесть цитрусовых нот гармонично сочетаются в насыщенном, ярком и заряжающем энергией аромате Chopard. <br><br>
Одновременно смелая и утонченная, кристально чистая и многогранная композиция посвящена исцеляющей силе природы и первозданной красоте тропических лесов индонезийского острова Суматра. 
<br><br>
Пачули звучат еще более выразительно, экзотично и натурально благодаря искрящимся, сочным нотам калабрийского бергамота и кафрского лайма. <br>Это уникальное парфюмерное сочетание дарит ощущение благополучия и свободы. Классификация аромата: шипровый ароматический. 
<br><br>
Парфюмер – Dora Baghriche.",Только для наружного применения.,Италия
https://goldapple.ru/19000234830-amber-lily,Amber Lily,3490,,"Лаконичная аромасвеча из природного кокосового воска плавно наполнит ваше пространство насыщенным парфюмированным шлейфом. Благодаря низкой температуре плавления, кокосовый воск тает эстетично, не оставляя лунок вокруг пламени. Терпкий древесный аромат амбры, имбиря и водяной лилии. Ярчайший аромат с высоким душистым спектром, быстро наполняет собой окружающее пространство. Ноты чёрного кардамона и имбиря мгновенно задают тон всей композиции. Плавные аккорды жасмина и орхидеи смягчают аромат, постепенно растворяясь в насыщенный шлейф, приправленный нотками сандала и кожи. <br> AMBER LILY - идеальный аромат для тех, кто обожает терпкие восточные композиции и мечтает наполнить своё помещение согревающим пряным ароматом. Выбирайте AMBER LILY, если хотите украсить натуральный интерьер просторной гостиной с элементами темного дерева, мрамора и растений.","Перед использованием удалите все декоративные элементы упаковки. Выберите удобное место для свечи, недоступное для детей и животных. Держите свечу зажженной не менее 20 и не более 30 минут. <br> Меры предосторожности <br> Не оставляйте зажженную свечу без присмотра и на сквозняках. <br> Располагать свечу вне зоны досягаемости детей и домашних животных. <br> Соблюдайте безопасное расстояние от пожароопасных предметов. <br> Обязательной сертификации не подлежит.",Россия
https://goldapple.ru/19000117826-aqua-millefolia,Aqua Millefolia ,3460,4.4,"Аромат AQUA MILLEFOLIA посвящен вавилонским Висячим садам Семирамиды, одному из 7 чудес света. 
<br/>После проливного летнего дождя в мифических садах и на террасах, залитых солнечным светом, мог витать свежий аромат вербены. 
<br/>Великолепный парфюмерный мираж дополняют искрящиеся цитрусовые ноты и прохладное звучание мяты. Лимон, вербена и гальбанум манят на эту зеленую тропу и ведут в удивительный оазис, наполненный ароматами диких трав и цветов. 
<br/>Уникальная композиция LE COUVENT, созданная на основе насыщенных абсолютов, разработана в традициях французской высокой парфюмерии.",Только для наружного применения.,Франция
https://goldapple.ru/19000234743-africa,Africa,3490,,"Тёплый, пряный древесный аромат кардамона и мягкой кожи. Аромат высокой насыщенности, который заполняет собой все помещение. Ноты бергамота и мускуса заявляют о себе ярким древесным оттенком. Ведущие аккорды кардамона и кожи придают аромату брутальность и терпкость. Душистый шлейф приправлен пряным тмином и шафраном.<br>Вы влюбитесь в AFRICA, если вы - поклонник свежих древесных ароматов, а также если скучаете по песчаным дюнам и сафари.<br>AFRICA подойдёт для просторных залов и гостиных, а также для интерьеров с природными элементами.","Наполните стеклянный флакон арома жидкостью из пластикового рефила. Поставьте в стеклянный флакон с жидкостью палочки из микрофибры. Регулируйте насыщенность аромата с помощью количества палочек - чем больше палочек во флаконе, тем более интенсивным будет аромат.",Россия
https://goldapple.ru/19000078008-base-apricot-basil, Base Apricot & basil,1436,,Аромат сочного абрикоса идеально дополненный нотами свежего базилика.,"Ароматический диффузор Oxygen Home из коллекции Base отлично подходит для ароматизации помещения приятными и ненавязчивыми ароматами. Откройте флакон и поместите в него палочки.
Для усиления яркости аромата переворачивайте палочки и перемешивайте жидкость.",Россия
https://goldapple.ru/19000234747-amber-lily,Amber Lily,3490,,"Терпкий древесный аромат амбры, имбиря и водяной лилии. Ярчайший аромат с высоким душистым спектром, быстро наполняет собой окружающее пространство. Ноты чёрного кардамона и имбиря мгновенно задают тон всей композиции. Плавные аккорды жасмина и орхидеи смягчают аромат, постепенно растворяясь в насыщенный шлейф, приправленный нотками сандала и кожи.<br> AMBER LILY - идеальный аромат для тех, кто обожает терпкие восточные композиции и мечтает наполнить своё помещение согревающим пряным ароматом. <br>Выбирайте AMBER LILY, если хотите украсить натуральный интерьер просторной гостиной с элементами темного дерева, мрамора и растений.","Наполните стеклянный флакон арома жидкостью из пластикового рефила. Поставьте в стеклянный флакон с жидкостью палочки из микрофибры. Регулируйте насыщенность аромата с помощью количества палочек - чем больше палочек во флаконе, тем более интенсивным будет аромат.",Россия
https://goldapple.ru/26800900001-feminin-pluriel,Feminin Pluriel ,22000,5,Красивый многогранный ольфактивный дуэт неподвластный мимолѐтным тенденциям моды. Он бросает вызов времени в поисках вечности подобно неизменным произведениям истинной классики.,,Франция
https://goldapple.ru/19000234749-bamboo,Bamboo,3490,,"Зеленый свежий аромат весенних цветов и стебля бамбука. Аромат со средней насыщенностью душистых веществ, мягко наполняет собой пространство. Ноты бергамота и бамбука растворяются в мягкую растительную дымку. Ведущие аккорды лилии и иланг-иланга насыщают пространство цветочным ароматом. Финальный штрих - нота ванили - окрашивает помещение сладостью.<br> BAMBOO точно пополнит вашу коллекцию ароматов, если вы - фанат растительной свежести и нежного аромата цветов.BAMBOO идеален для светлых интерьеров, небольшой спальни и ванной комнаты.","Наполните стеклянный флакон арома жидкостью из пластикового рефила. Поставьте в стеклянный флакон с жидкостью палочки из микрофибры. Регулируйте насыщенность аромата с помощью количества палочек - чем больше палочек во флаконе, тем более интенсивным будет аромат.",Россия
