Ссылка,Наименование,Цена,Рейтинг пользователей,Описание продукта,Инструкция по применению,Cтрана-производитель
https://goldapple.ru/19000148360-the-musc-refillable,The Musc refillable,7372,5,"Парфюмер – Calice Becker. «Я представляла этот аромат как облако обволакивающего, нежного, восхитительного мускуса в сочетании с имбирём и лавандой. Светлое цветочное сердце композиции гармонирует с мягкими древесными нотами и сандалом из Австралии».<br><br>

Одновременно медовый и свежий аромат The Musc – это тонкое сочетание пленительных нот. Чарующую и тёплую композицию открывают имбирь из Лаоса и французская лаванда. Натуральный пчелиный воск дарит сердцу аромата сливочную сладость, которую усиливают тонкие ноты мускуса. Австралийский сандал подчеркивает теплоту древесных нот. <br><br>

Создатели парфюмерной воды ESSENTIAL PARFUMS выбирают натуральные, экологически чистые материалы и стремятся снизить воздействие на окружающую среду. Компания использует сандал из Западной Австралии, чтобы обеспечить стабильные поставки ингредиента и поддержать местные общины, создав для них устойчивый источник дохода.<br><br>

Флакон парфюмерной воды подходит для многоразового использования, и его можно пополнять из рефила.",Только для наружного применения.,Франция
https://goldapple.ru/19000234754-carolina,Carolina,2290,,"Нежный лёгкий аромат сладкого капучино и весенних цветов. Аромат средней насыщенности, мягко раскрывается в помещении. Кофейные и миндальные ноты постепенно растворяются в тёплый терпкий аромат. Цветы жасмина, ириса и бергамота распускаются аккордами свежести и легкой прохлады. Аромат оставляет мягкий шлейф пряного какао. <br> Вы влюбитесь в CAROLINA, если вы - поклонник маленьких кофеен и десертов, а также если вы хотите придать помещению тепло и некую таинственность. <br> CAROLINA - идеальный аромат для просторных светлых залов и ванных комнат. Также CAROLINA отлично впишется в обстановку салона красоты.","Наполните стеклянный флакон арома жидкостью из пластикового рефила наполовину. Поставьте в стеклянный флакон с жидкостью палочки из микрофибры. Регулируйте насыщенность аромата с помощью количества палочек - чем больше палочек во флаконе, тем более интенсивным будет аромат.",Россия
https://goldapple.ru/19000118586-levante,LEVANTE,3492,,"Chiara Firenze посвящает свои ароматы в особый регион: Тоскана. история совершенства, страсти и связи с территорией, а также диалога между знаниями и далекими культурами. парфюмерное искусство и выбор ценных эфирных масел, таким образом, встречает мастеров флорентийских ремесленных мастерских, чтобы возродить магию этой особой земли в ваших комнатах.
Аромат получил свое название от легкого свежего и влажного ветра Леванта, дующего с Востока, где рождается Солнце. 
Согрейте обстановку вашего дома ароматическими нотами листьев апельсина и мандарина, кульминацией которых станет цветочная сердцевина.",,Италия
https://goldapple.ru/19760313142-dark-cherry-amber,Dark Cherry & Amber,5235,4.6,"Dark Cherry & Amber от Banana Republic – это восточный цветочный аромат, раскрывающий нежную сладость спелой и сочной вишни и розовой фрезии. В сердце композиции – вишнёвый цвет и гурманская нота пралине, которые формируют манящий и соблазнительный характер аромата. Древесный аккорд с белым кедром и амбра окутывают теплом и добавляют чувственность, перед которой невозможно устоять. <p>
Парфюмер – Claude Dir.",Только для наружного применения.,Франция
https://goldapple.ru/7201000012-3-l-imperatrice,L’Imperatrice Eau de Toilette,4992,4.9,"Туалетная вода L'Imperatrice от известного итальянского бренда DOLCE & GABBANA - воплощение женской чувственности, нежности и тайны, которую стремится узнать каждый мужчина.
Эксклюзивная туалетная вода для роскошных дам
Образ, вдохновивший парфюмеров DOLCE & GABBANA на создание композиции L'Imperatrice  - это молодая, независимая и эффектная женщина, обладающая магнетическим шармом, прирожденным обаянием и очаровательной харизмой, перед которой невозможно устоять.
Аромат создает мягкую, но в то же время динамичную и интригующую атмосферу страсти и соблазна, завораживая и увлекая окружающих в мир сладких грез и фантазий. Туалетная вода L'Imperatrice от DOLCE&GABBAN универсальна. Она одинаково хорошо сочетается как с дневным, так и с вечерним нарядом, подчеркивая яркую индивидуальность, неотразимость и безупречное чувство стиля своей обладательницы.
Верхние ноты аромата раскрываются в роскошном сочетании аккордов экзотических фруктов и розовых цветов. Затем в ансамбль плавно вступают гармоничные ноты сердца, которые проявляются в легком и свежем звучании спелого арбуза и ягод киви. Нежный и чарующий базовый шлейф, сотканный из цветочно-пряных розовых цикламенов и мускуса, наполнит утонченный аромат бодрым, весенним настроением.
Идеальная гармония содержания и формы
Для флакона аромата L'Imperatrice DOLCE & GABBANA парфюмеры избрали элегантную классическую форму. Флакон выполнен из прозрачного органического стекла, декорированного стильной надписью с названием композиции и бренда. Черный колпачок символизирует интригу и загадочность, которые сокрыты в бездонных глубинах женской души.",,Франция
https://goldapple.ru/83290100009-rose-seljuke,Rose seljuke ,21600,,"Восточный аромат с цветочными акцентами вдохновлен висячими садами Семирамиды. <br><br>

Композиция начинает свое звучание утонченным аккордом дамасской розы, который переплетается с теплой сладостью мадагаскарской ванили. Их дополняет нежный сливочный оттенок бобов тонка в сочетании с древесиной и отзвуком перуанского бальзама.",Только для наружного применения.,Италия
https://goldapple.ru/84140700004-loewe-001,001 WOMAN,10890,5,"После прошлогоднего успеха парфюмерной линии LOEWE 001 – первого парного аромата испанского дома под руководством креативного директора Джонатана Андерсона – в свет выходит женская туалетная вода, дарующая новый взгляд на аромат благодаря более легким и свежим нотам. Запуск представляет собой продолжение истории о встрече влюбленных, которая началась в прошлом году. Ясность в соблазнительных, чувственных нотах аромата и в отчетливой чистой упаковке. Выполненная из древесины зебрано крышка является отличительной чертой флакона туалетной воды 001 и подчеркивает ее принадлежность к природе. Особая композиция ингредиентов – отличная от парфюмерной версии 001 – создает насыщенный, яркий эффект нового звучания аромата: верхние ноты  – сандаловое дерево и цитрус. В сердце аромата отчетливо слышны фруктовые ноты.",,
https://goldapple.ru/19000122389-summer-lovers,Summer lovers,3149,,"Тот самый аромат, переносящий Вас в летний вечер на берегу океана…
<br/>Бодрящее звучание индийского ананаса в центре композиции с оттенком розового перца, розы, пачули и свежести фиалкового листа.
<br/>Потушить свечу можно благодаря бетонной крышечки в комплекте, а так же она убережет свечу от пыли и увеличит срок службы изделия.
<br/>Для равномерного прогорания первый раз зажигайте свечу не менее чем на 2 часа.
<br/>При последующих зажиганиях следует подрезать фитиль на пару миллиметров.
<br/>Объем 250мл. Время горения ~40 часов.",Зажечь фитиль. Беречь от детей и домашних животных - помнить про технику безопасности! Для равномерного прогорания первый раз зажигайте свечу не менее чем на 2 часа. При последующих зажиганиях следует подрезать фитиль на пару миллиметров.,Россия
https://goldapple.ru/83810100011-moon-dust,MOON DUST,16384,4.6,"Астронавты говорят, что лунная пыль пахнет порохом. Загадочный, возвышенный, футуристический аромат MiN NEW YORK Moon Dust по-своему раскрывает эту историю. Минеральные ноты, кремень, озон и табак уносят далеко от Земли. Их дополняют кориандр и морковные семена. Бензоин, чёрный мускус и землистые ноты создают базу необыкновенного, как пустыня после дождя, аромата.",,Франция
https://goldapple.ru/19000258595-nina-illusion,NINA ILLUSION,9732,,"Магия культовых яблочек Nina Ricci, воплощенная в новом аромате Nina Illusion. 

<br><br>Уникальные пикантные ноты японского юзу переплетаются с нотами розового перца и поражают с первого вздоха. Игривые ноты ванили в обрамлении бархатистости цветка апельсина создают яркое и роскошное звучание. Завершающий штрих - сливочные ноты ванили и слегка теплые ноты пачули. 

<br><br>Шипровая цветочно-фруктовая композиция подарит вам невероятное ольфакторное наслаждение и окунет в чудесный мир Nina Ricci.

<br><br>Парфюмеры: Оливье Кресп, Николя Бонневиль.","Нанести на кожу, избегая попадания в глаза.",Испания
https://goldapple.ru/19000234757-cherry-blossom,Cherry Blossom,3490,,"Сладкий пряный аромат наливной вишни и весенних цветов. Аромат высокой насыщенности, расставляет акценты во всем пространстве комнаты. Первичные ноты - вишня и горький миндаль - раскрываются в терпкий, яркий аромат вишневого ликера. Аккорды розы и жасмина сливаются в мягкий цветочный шлейф, сладость которого усиливается нотой ванили. <br> Вы влюбитесь в CHERRY BLOSSOM, если вы - поклонник нежных, сладких ароматов и сочной спелой вишни. <br> CHERRY BLOSSOM - идеальный аромат для кухни, просторного холла и ванной комнаты в светлом интерьере.","Наполните стеклянный флакон арома жидкостью из пластикового рефила. Поставьте в стеклянный флакон с жидкостью палочки из микрофибры. Регулируйте насыщенность аромата с помощью количества палочек - чем больше палочек во флаконе, тем более интенсивным будет аромат.",Россия
https://goldapple.ru/7431400001-bright-crystal-absolu,Bright Crystal Absolu ,5482,5,"Парфюмерная вода Versace Bright Crystal Absolu выпущен модным домом в 2014 году. Относится к категории цветочно-фруктовых запахов. Автор парфюмерной воды Альберто Мориллас создал запоминающуюся ароматический букет из граната, пиона, малины, лотоса, магнолии, амбры и махагони. Яркий гранатовый букет Versace оставляет после себя терпкий запах, заставляет почувствовать себя желанной. Чувственные ноты магнолии помогают набраться сил. Махагони придает аромату благородный оттенок.",,Италия
https://goldapple.ru/19000076142-no2-jardin-neroli,№2 Jardin Neroli,4455,,Нежный и теплый цветочный бленд от ATMOS Moscow с умеренной сладостью и пудовыми оттенками. Главные герои чувственный нероли и манящий жасмин. Свежесть и благоухание цветов на подложке изысканного и согревающего сандала раскрываются запоминающимися звучаниями чистоты самой природы.,"Снимите всю упаковку. расположите свечу на ровной и устойчивой поверхности. Перед зажиганием, убедитесь, что длина фитиля не превышает 0,5см. время каждого горения свечи должно быть достаточным, чтобы вся поверхность воска успела равномерно расплавиться, чтобы предотвратить образование кратеров.",Россия
https://goldapple.ru/19000232227-discovery-set,Discovery set,3123,,"Попробуйте 9 оригинальных ароматов от 9 знаменитых парфюмеров, создавших яркие и выразительные композиции для ESSENTIAL PARFUMS. <br><br>

В набор пробников входят ароматы:<br>
- ORANGE X SANTAL by Natalie Gracia-Cetto (2 мл), <br>
- NICE BERGAMOTE by Antoine Maisondieu (2 мл), <br>
- THE MUSC by Calice Becker (2 мл), <br>
- ROSE MAGNETIC by Sophie Labbé (2 мл), <br>
- MON VETIVER by Bruno Jovanovic (2 мл), <br>
- DIVINE VANILLE by Olivier Pescheux (2 мл), <br>
- BOIS IMPERIAL by Quentin Bisch (2 мл), <br>
- FIG INFUSION by Nathalie Lorson (2 мл), PATCHOULI MANIA by Fabrice Pellegin (2 мл). <br><br>

Откройте для себя изысканные ароматы, созданные на основе тщательно отобранных и экологически чистых ингредиентов, и выберите любимые парфюмерные композиции!",Только для наружного применения.,Франция
https://goldapple.ru/19000125257-ganymede,Ganymede,17005,4.6,"Аромат онейрической реальности.<br>
Для нового опуса не изменился ни дуэт, ни творческий осмос между Марком-Антуаном Барруа и Квентином Бишем, но пункт назначения находится в другом месте. Создавая элегантную и неожиданную гармонию вокруг квартета из мандарина, фиалки, бессмертника и замши, два коллеги-художника мечтали о новой планете: Ганимед, скалистый спутник Юпитера, открытый в 1610 году Галилеем, сияет и покрыт солеными океанами. Свое название он получил из греческой мифологии: юноша Ганимед был похищен богами, которые были настолько очарованы его красотой, что даровали ему бессмертие.<br>
Созданный парфюмером Квентином Бишем, в Ganymede снова используются замшево-кожаные ноты, которые сделали B683 прекрасной классикой. Однако на этот раз художники освободились от традиционных кодов, чтобы увести нас куда-то еще, к блестящей и плавной элегантности. Кожаные ноты становятся мягче, приобретая легкость и нежность при соприкосновении с ароматом фиалки. <br>
Запах мандарина приносит живость и кислую сущность, придавая аромату структуру. Противостоя ему, бессмертник является его контрапунктом и поднимает ароматическую гармонию своим двойственным ароматом, то минеральным, то соленым. Вся композиция играет контрастами и противопоставлениями.",,Франция
https://goldapple.ru/19000150183-un-deux-trois-soleil,Un Deux Trois Soleil,11850,,"Французская парфюмерная вода BASTILLE произведена на основе натуральных компонентов. Светлый и озорной восточный аромат UN DEUX TROIS SOLEIL пробуждает теплые воспоминания о детстве: послеобеденных играх с друзьями в солнечный день или семейных праздниках, во время которых угощают лакомствами. <br>
В беззаботное время возвращают игривые гурманские ноты, многим знакомые с ранних лет: миндаль, ваниль и многогранные бобы тонка. Их сладость смягчают сияющие ноты цитрусов, гелиотропа и бензоина. <br>
Парфюмер – Domitille Michalon-Bertier.",Для наружного применения.,Франция
https://goldapple.ru/19000145074-peony-peppercorn,PEONY & PEPPERCORN,5690,4.4,"Peony & Peppercorn от Banana Republic – это цветочно-пряный аромат, который раскрывается пикантными нотами розового перца и свежестью бергамота. Верхние ноты плавно уступают место ароматному букету из элегантных розовых пионов и нежных лепестков розы, объединённых в сердце парфюмерной композиции. Мускус и древесные ноты делают аромат более многогранным и смелым. <p>
Парфюмер – Vincent Kuczinski.",Только для наружного применения.,Франция
https://goldapple.ru/19000118621-venere,VENERE,3492,,"Chiara Firenze посвящает свои ароматы в особый регион: Тоскана. история совершенства, страсти и связи с территорией, а также диалога между знаниями и далекими культурами. парфюмерное искусство и выбор ценных эфирных масел, таким образом, встречает мастеров флорентийских ремесленных мастерских, чтобы возродить магию этой особой земли в ваших комнатах.
Лаванда - незаменимый символ греческой Богини Венеры в ее заклинаниях любви и очищения, а цветы лотоса с теплыми и мягкими нотами, - символы ее красоты и чистоты. Этот союз обогащен нотами бергамота, который своим свежим и чистым ароматом дарит ощущение радости и безмятежности.
Уникальный аромат, который ведет к благополучию и счастью!",,Италия
