Ссылка,Наименование,Цена,Рейтинг пользователей,Описание продукта,Инструкция по применению,Cтрана-производитель
https://goldapple.ru/19000234789-rose-and-peach,Rose and Peach,3490,,"Цветочный аромат сочного персика и лепестков нежной розы. Аромат высокой насыщенности, благодаря которому в вашей комнате будет пахнуть спелыми персиками и сливами. Ноты розы и корицы придают аромату сладость и пряность. Аккорды чёрной смородины и кокоса раскрываются в помещении в душистый сладкий шлейф. <br> Вы полюбите ROSE AND PEACH, если давно мечтаете оказаться в согретой солнцем Италии и хотите ощутить в своём доме долгожданное жаркое лето. Аромат подойдёт как для просторной гостиной, так и для ванной комнаты. <br> ROSE AND PEACH также идеально впишется в светлые интерьеры с панорамными окнами.","Наполните стеклянный флакон арома жидкостью из пластикового рефила. Поставьте в стеклянный флакон с жидкостью палочки из микрофибры. Регулируйте насыщенность аромата с помощью количества палочек - чем больше палочек во флаконе, тем более интенсивным будет аромат.",Россия
https://goldapple.ru/19000008797-travel-set-plush-onsen-voodoo,"TRAVEL SET: PLUSH, ONSEN, VOODOO",8192,4,"Открывайте для себя мир и новые ароматы! В набор для путешествий MIN NEW YORK входят 3 миниатюры парфюмерной воды: PLUSH (10 мл), ONSEN (10 мл) и VOODOO (10 мл). Объем, идеальный для поездок, позволит всегда носить любимый аромат с собой или брать его в путешествия. В композиции PLUSH ваниль, жасмин, ирис и апельсиновый цвет аккуратно собраны в букет, украшенный нотами роскошного мускуса и серой амбры. Их дополняют миндаль и гвоздика, а гальбанум усиливает металлические грани притягательного аромата. Композиция ONSEN стартует с нот бергамота, фенхеля, розмарина, тимьяна и эстрагона. В сердце этого необыкновенного зелья – сосновые иголки, кипарис и морской аккорд, а среди базовых нот – дубовый мох, ветивер и серая амбра. Аромат VOODOO с нотами ладана, герани, гальбанума, лайма и розового перца разжигает огонь влечения. Глубокая композиция построена вокруг нот, традиционных для бахура – восточной ароматической смеси. Среди них выделяются уд, пачули, сандал, роза, кожа и кардамон.",,Франция
https://goldapple.ru/83730100002-contessa,Contessa ,30607,,"Contessa – портрет итальянской аристократки, жившей в 19 веке в маленьком тосканском городке, где узкие дорожки вели к холмам, покрытым оливковыми деревьями и виноградными лозами. Именно эти пейзажи и женственность их главной героини вдохновили парфюмеров Moresque на создание аромата Contessa. Пряная цветочная композиция раскрывается нотами розы, жасмина и иланг-иланга",,
https://goldapple.ru/19000234939-tobacco-vanilla,Tobacco Vanilla,1590,,"Моментальная и насыщенная ароматизация пространства. Парфюм для вашего интерьера и домашнего пространства подарит мгновенную и стойкую ароматизацию на 24 часа. Идеальный вариант для создания атмосферы и настроения по особому поводу. Подходит для использования на домашнем текстиле, шторах и мягких поверхностей мебели","Распылить на текстильные элементы мебели на расстоянии 15-30 см. Интерьерный парфюм предназначен для ароматизации пространства, поэтому вы также можете распылить его в воздух в комнате.",Россия
https://goldapple.ru/19000117829-aqua-minimes,Aqua Minimes,2892,4.5,"Парфюмерная композиция AQUA MINIMES раскрывает ослепительную свежесть аромата, витающего в тихом цитрусовом саду по утрам, когда еще не исчезла прохладная роса. 
<br/>Бодрящее древесно-цитрусовое звучание напоминает о первых лучах солнца, пробивающихся сквозь листья деревьев. Начало нового дня знаменуют яркий цитрон, литсея и мандарин. 
<br/>Элегантность им придают землистый оттенок ветивера и благородная древесная нота кедра. 
<br/>Насыщенный аромат, созданный на основе натуральных растительных эссенций, разработан в традициях французской высокой парфюмерии.",Только для наружного применения.,Франция
https://goldapple.ru/19000118780-silver-cedar,Silver Cedar,3031,,"Спрей для дома Durance мгновенно ароматизируют все комнаты в доме, чтобы создать индивидуальную атмосферу. Теплая атмосфера, где сладкий аромат корицы совершенствуется с сочными ароматами апельсиновых фруктов, чтобы осветить ваш дом для ваших близких.<br>
Острые ноты серебряного кедра отрезвляют, в то время как сандаловое дерево еще более усиливает наши чувства.",,Франция
https://goldapple.ru/19000222751-rose-oud,ROSE OUD,16912,5,"Богатая и насыщенная эссенция агарового дерева в коллекции OUD полностью посвящена традициям французской элегантности, увековеченной Патрисией де Николаи.<br><br>

Rose Oud — «французско-ориентальная» классика. Роскошная красная роза с пряными, фруктовыми акцентами перекликается с древесными и животными оттенками уда, создавая шипровый эффект. <br><br>

Благодаря этому сочетанию королева цветов выходит за пределы проторенного пути и обычного романтического имиджа.",Только для наружного применения.,Франция
https://goldapple.ru/7431800005-eros-pour-femme,Eros Pour Femme ,7091,4.9,"Туалетная вода Versace Eros Pour Femme – это новое измерение свежести, захватывающей и чувственной. В верхних нотах композиции - изысканные цитрусовые: сицилийский лимон и мандарин, и искрящиеся фруктовые ноты малины и белой смородины. Волнующие ноты лепестков фрезии и магнолии отсылают к женской природе аромата, а померанец и жасмин подчёркивают интенсивность и характер композиции. Смелый акцент белых пачули в сочетании с яркими древесными оттенками, мускусом и амброксаном придают аромату чувственность.",,Италия
https://goldapple.ru/19000201939-tobacco-amber,Tobacco & Amber,10762,,Восточная экзотика вдохновила бренд Cereria Molla на создание аромата «Амбра и табак». Звенящие цитрусовые ноты приглашают к знакомству с чувственным сердцем. Обволакивающие глубокие ноты амбры переплетены с благородством индийского терпкого табака в сердце парфюмерной композиции. Аккорды бархатистой лаванды в шлейфе лишь подчеркивают обвораживающие восточное звучание аромата.,"Предназначен для ароматизации воздуха в помещениях. Вскрыть флакон с ароматом, наполнить аромадиффузор, вставить палочки, рекомендованные производителем. Для оптимального распространения аромата регулярно переворачивать палочки. Для регулирования интенсивности аромата допускается уменьшать/увеличивать количество палочек.",Испания
https://goldapple.ru/19000152688-isla-paradis,ISLA PARADIS,900,4.2,"Аромат LE PARFUM FRANCAIS переносит на тропический пляж с теплым песком, шумом волн и согревающими лучами солнца. 
<br/>Ярко представить райский пейзаж помогают фруктовые ноты грейпфрута, сочного персика и кокоса. В сердце экзотической композиции – гардения, цветок апельсина и ландыш. <br/>Этот цветочный солнечный аромат – парфюмерное путешествие в беззаботное лето.",,Франция
https://goldapple.ru/19000174064-light-green-22-cm-5-mm,"light green 22 cm, 5 mm",1080,,"Фибровые палочки светло-зеленые толстые. Длина 22 см, диаметр 5 мм. <br>
Фиброволокно прекрасно впитывает и отдает аромат. Это синтетическое пористое вещество, ароматические эссенции впитывает равномерно и быстро. Аромат распространяется в пространстве пленяющим шлейфом. <br>
Палочки используются только с арома-композициями, диффузорами и другими ёмкостями для парфюмерных жидкостей. Ознакомьтесь со всей линейкой парфюма VENEW, кликнув по бренду. Ароматизатор для дома с палочками заиграет для вас новыми красками.","Избавьте палочки от упаковки, вставьте в диффузор или ёмкость с арома-композицией. Через несколько минут переверните палочки. Регулировать интенсивность отдачи аромата в воздух очень легко. Если нужно более нежное, невесомое звучание, часть палочек уберите. Чтобы сделать запах более насыщенным – добавьте больше. При смене жидкости в диффузоре обязательно ставьте новые палочки.",Россия
https://goldapple.ru/19000121298-diamond,Diamond ,11076,5,"В изысканный набор входят парфюмерная вода DIAMOND (100 мл), её миниатюра в тревел-формате (15 мл) и распылитель. <br>
Древние греки верили, что алмазы – это осколки звезд, упавшие с неба, в древней Индии алмазам приписывали способность защищать от зла, а римляне первыми начали использовать их как символ вечной любви. Композиция DIAMOND, названная в честь этих драгоценных камней, стала парфюмерным воплощением соблазна, ведь алмазы веками обольщали людей и продолжают очаровывать нас по сей день. <br>
Притягательная сила аромата SIGNATURE by Sillage d'Orient кроется в ярком сочетании чувственной ноты арабской амбры, таинственного ладана и благородного, ценного уда с его темным очарованием.",Распылять на кожу с расстояния 20-30 см.,Франция
https://goldapple.ru/19000011255-booster-eau-de-la-nuit,Booster Eau De La Nuit ,21868,,"Обольстительный аромат,  сотканный  из древесных,  амбровых и мускусных оттенков, загадочный  и  вызывающий зависимость.  Этот  аромат медленно раскрывается и долго держится на коже, вызывая  непрерывное  желание  вдыхать его все больше и больше. Он наполнит соблазнительной чувственностью любой аромат, с которым вы его смешаете.
<p>
Верхние ноты: бергамот.
Ноты сердца: древесные ноты, амбра.
Базовые ноты: розовый перец, мускус.",,Россия
https://goldapple.ru/26801300002-baccarat-rouge-540,BACCARAT ROUGE 540,30500,4.7,"Магический альянс Природы и Человека, который трансформирует сырьё в осязаемые элементы. Абсолютное единение человеческого мастерства, природного минерала и огня.  Таким образом родился аромат Baccarat Rouge 540,  лаконичный и в то же время графичный ольфактивный автограф.  Изысканная и яркая парфюмерная вода с цветочно-амбровыми и древесными оттенками.",,Франция
https://goldapple.ru/19000222738-bois-belize-intense,BOIS BÉLIZE INTENSE,5047,5,"Коллекция INTENSE — исключительные ароматы в «интенсивной» версии, изготовленные из лучшего и уникального сырья.<br>
Bois Bélize Intense — дымящийся чай, завернутый в ценные породы дерева. В старте бергамот и гваяковое дерево в сочетании с листьями мате образуют экзотическую ноту сладкой горечи. Нежная нота розы с кардамоном, гвоздикой и дубовым мхом придает композиции восхитительно пряный оттенок.",Только для наружного применения.,Франция
https://goldapple.ru/19000059309-private-collection-l-floral-chypre,Private Collection L Floral Chypre ,40590,,"Молодой, жаждущий знаний студент находит неисчерпаемый источник вдохновения в кипучей энергии таких городов, как Лондон и Эдинбург. Великолепие грандиозных архитектурных ансамблей покоряет его сердце и он представляет их как сокровища, призванные украсить и без того роскошные пейзажи природы. 
<b> 
Этот аромат вызывает воспоминания о волшебных и загадочных садах, которые являются воплощением души самой природы. Композиция гипнотизирует аккордом жасмина самбака и розы, горделиво красующихся на роскошной базе из пачули.",Нанести на пульсирующие точки,Великобритания
https://goldapple.ru/19000110361-burning-for-oud,BURNING FOR OUD,2106,4.2,"Страстная восточная композиция BURNING FOR OUD от L’ATELIER PARFUM раскрывает разные грани уда: древесную, кожаную и даже анималистическую. Аромат этого дерева, часто используемого для создания благовоний, кажется почти священным – он успокаивает, дарит вдохновение и пробуждает духовность. Яркость загадочной дымке уда придаёт розовый перец, подчеркивающий чувственную сторону композиции, а сочетание кедра, пряных нот и амбры смягчает базовые ноты ладана и благородного, выдержанного рома. Ключевые ноты: уд, амбра, розовый перец. Парфюмер - ALEXIS DADIER.",только для наружного применения.,Франция
https://goldapple.ru/19000234744-altai,Altai,2290,,"Насыщенный аромат с высокой концентрацией душистых веществ. Ярчайшие ноты сосны и древесной смолы быстро наполняют помещение ярчайшим ароматом коры дерева и хвои. Аккорд корицы добавляет шлейфу пряность, а мягкие нотки мяты и бергамота - свежесть и легкую прохладу. Вы точно влюбитесь в ALTAI, если мечтаете ощущать в помещении запах горящих в камине поленьев и хвойного леса. <br>ALTAI - идеальное решение для загородного дома и деревянных интерьеров, а также для просторной гостиной в темных тонах.","Наполните стеклянный флакон арома жидкостью из пластикового рефила наполовину. Поставьте в стеклянный флакон с жидкостью палочки из микрофибры. Регулируйте насыщенность аромата с помощью количества палочек - чем больше палочек во флаконе, тем более интенсивным будет аромат.",Россия
https://goldapple.ru/26802000002-oud-silk-mood,Oud Silk Mood,29000,5,"Нежный аромат – воздушная невесомость загадочного уда, в котором слышится то ли шелест шёлка, то ли мягкое прикосновение розовых лепестков.",,Франция
https://goldapple.ru/19000019544-peach-passion-fruit-musk,"Peach, Passion fruit, Musk ",2200,4.8,"Я хочу, чтобы парфюм трогал до глубины души, говорил о личности и отражал ее уникальность.<br>
Эрез Розен <br><br>

Замысловатая ольфакторная книга, сюжет которой раскрывается новыми гранями на каждом человеке. Необычные сочетания нот и оригинальное построение аккордов подчеркивают индивидуальность и раскрывают суть ярче любых слов. <br><br>

Все ароматы Zielinski&Rozen категории унисекс.",Наносите парфюм по обе стороны плеч или распылите впереди себя и войдите в «облако» аромата.,Россия
https://goldapple.ru/19000120656-isfarkand,Isfarkand ,11385,,"""Стильный, энергичный и чувственный"" - так Ormonde Jayne представляет аромат ""Isfarkand"". Мягкие ноты лайма, мандарина и масла бергамота под покровом розового перца, кедра, ветивера, ириса и мха.",Нанести на пульсирующие точки,Великобритания
https://goldapple.ru/80130600001-in-blue,In Blue,5898,5,"Туалетная вода Armand Basi  — освежающий и бодрящий аромат для истинных мужчин. Armand Basi начали букет из бергамота, грейпфрута и мандарина, дарящих Средиземноморскую свежесть, и подчеркнув всё аккордом тёплого кориандра. В самой сердцевине лежит комбинация благородных цветов лотоса и нероли, дополненных насыщенным перцем и ростками чёрной смородины. В туалетной воде чувственные древесные ноты мха дуба и сладости пачули добавляют уникальности мужественному характеру аромата.",Только для наружного применения.,Италия
https://goldapple.ru/19000173783-une-escale-dans-les-calanques,Une escale dans les calanques,2884,4,"Прикоснитесь к искусству жизни на Юге Франции с уникальными композициями из Грасса. Песнь цикад, летний зной и кристально чистая вода в бухте. Парфюмерная вода Une escale dans les calanques приглашает сделать остановку в бухте и забыть обо всем. <br>
Солнечная и бодрящая волна цитрусов оставляет после себя ощущение счастья. Йод, напоминающий морские брызги, усиливает звучание композиции. Теплый песок смешивается с древесными нотами и акцент в виде бессмертника.",Распылите на кожу на расстоянии 20-30 см.,Франция
